institution_name,inst_type_name,institution_city,state_abbv,active_ind,display_order
University of Dallas,University,Irving,TX,Y,1541
University of Dayton,University,Dayton,OH,Y,1542
University of Delaware Alumni Association,Alumni Association,Newark,DE,Y,1543
University of Denver,Alumni Association,Denver,CO,Y,1544
University of Denver Alumni Association,Alumni Association,Denver,CO,Y,1545
University of Denver and the Denver Alumni Association,"Alumni Association, University",Denver,CO,Y,1546
University of Dubuque,University,Dubuque,IA,Y,1547
University of Evansville,University,Evansville,IN,Y,1548
University of Florida,"Alumni Association, University",Gainesvile,FL,Y,1549
University of Florida,Alumni Association,Gainesville,FL,Y,1550
"University of Florida Alumni Assicuatuibm Inc., University of Florida Foundation, Inc. and The University Athletic Association, Inc. ","Alumni Association, Foundation, Other",Gainesville,FL,Y,1551
"University of Florida Alumni Association, Inc. and The University Athletic Association, Inc.","Alumni Association, Other",Gainesville,FL,Y,1552
"University of Florida Alumni Association, Inc., and the University Athletic Association, Inc. ","Alumni Association, Other",Gainesville,FL,Y,1553
"University of Florida Alumni Association, Inc., University of Florida Foundation, Inc. and The University Athletic Association, Inc.","Alumni Association, Foundation, Other",Gainesville,FL,Y,1554
University of Hartford,Alumni Association,West Hartford,MA,Y,1555
University of Hartford Alumni Association,Alumni Association,West Hartford,CT,Y,1556
University of Hartford Alumni Association,Alumni Association,West Hartford,MA,Y,1557
University of Hawaii at Manoa,University,Honolulu,HI,Y,1558
University of Houston Alumni Association,Alumni Association,Houston,TX,Y,1559
University of Houston-Clear Lake,University,Houston,TX,Y,1560
University of Idaho,Alumni Association,Moscow,ID,Y,1561
University of Idaho Alumni Association,Alumni Association,Moscow,ID,Y,1562
University of Illinois Alumni Association,Alumni Association,Urbana,IL,Y,1563
University of Kentucky,University,Lexington,KY,Y,1564
University of Kentucky Alumni Association,Alumni Association,Lexington,KY,Y,1565
University of La Verne,University,La Verne,CA,Y,1566
University of Louisiana at Lafayette Alumni Association,Alumni Association,Lafayette,LA,Y,1567
University of Louisiana at Monroe Alumni Association,Alumni Association,Monroe,LA,Y,1568
University of Louisiana Monroe Alumni Association,Alumni Association,Monroe,LA,Y,1569
University of Louisville,University,Louisville,KY,Y,1570
University of Maine Alumni Association,Alumni Association,Orono,ME,Y,1571
University of Maine Alumni Association (UMAA),Alumni Association,Orono,ME,Y,1572
University of Maine General Alumni Association,Alumni Association,Orono,ME,Y,1573
University of Mary Washington Alumni Association and University of Mary Washington Foundation,"Alumni Association, Foundation",Fredericksburg,VA,Y,1574
University of Mary Washington Alumni Association and University of Mary Washington Foundation ,"Alumni Association, Foundation",Fredricksburg,VA,Y,1576
University of Mary Washington Alumni Association and University of Mary Washington Foundation ,Alumni Association,Fredricksburg,VA,Y,1577
University of Mary Washington Alumni Associationand University of Mary Washington Foundation ,Alumni Association,Fredricksburg,VA,Y,1578
University of Maryland Alumni Association,Alumni Association,College Park,MD,Y,1579
University of Maryland Alumni Association ,Alumni Association,College Park ,MD,Y,1580
"UNIVERSITY OF MARYLAND ALUMNI ASSOCIATION, INC. and M CLUB FOUNDATION, UNIVERISTY OF MARYLAND, INC.","Alumni Association, Foundation",College Park,MD,Y,1581
"University of Maryland Alumni Association, Inc. and M Club Foundation, University of Maryland, Inc.","Alumni Association, Foundation",College Park,MD,Y,1582
"University of Maryland Alumni Association, Inc., and M Club Foundation, University of Maryland, Inc.  ","Alumni Association, Foundation",College Park,MD,Y,1583
"University of Maryland Eastern Shore National Alumni Association, Inc.",Alumni Association,Princess Anne,MD,Y,1584
University of Maryland School of Law,University,Baltimore,MD,Y,1585
University of Maryland University College Alumni Association,Alumni Association,College Park,MD,Y,1586
University of Massachusetts Amherst Alumni Association,Alumni Association,Amherst,MA,Y,1587
"University of Massachusetts Amherst Alumni Association, Inc.",Alumni Association,Amherst,MA,Y,1588
University of Massachusetts Amherst Alumni AssociationInc,Alumni Association,Amherst,MA,Y,1589
University of Massachusetts Boston,University,Boston,MA,Y,1590
University of Massachusetts Lowell ,University,Lowell,MA,Y,1592
University of Massachusetts-Boston,University,Boston,MA,Y,1593
University of Massachusetts-Dartmouth Alumni Association,Alumni Association,North Dartmouth,MA,Y,1594
University of Medicine and Dentistry of New Jersey and Robert Wood Johnson Medical School Alumni Association,"Alumni Association, University",Piscataway,NJ,Y,1595
University of Memphis,University,Memphis,TN,Y,1596
University of Miami,University,Coral Gables,FL,Y,1597
University of Minnesota,Alumni Association,Minneapolis,MN,Y,1598
University of Minnesota Alumni Association,Alumni Association,Minneapolis,MN,Y,1599
University of Mississippi Alumni Association,Alumni Association,Oxford,MS,Y,1600
University of Mississippi Foundation,Foundation,Oxford,MS,Y,1601
University of Mississippi Foundation ,Foundation,University,MS,Y,1602
University of Mississippi Foundation ,Foundation,Oxford,MS,Y,1603
University of Missouri - Rolla,Alumni Association,Rolla,MO,Y,1604
University of Missouri Alumni Association,Alumni Association,Columbia,MO,Y,1605
University of Missouri Saint Louis Alumni Association,Alumni Association,Saint Louis,MO,Y,1606
University of Missouri St Louis Alumni Association,Alumni Association,St. Louis,MO,Y,1607
University of Missouri-St. Louis Alumni Association,Alumni Association,St. Louis,MO,Y,1608
University of MN - Moorhead,Alumni Association,Moorhead,MN,Y,1609
University of MO – STL,Alumni Association,St Louis,MO,Y,1610
University of Montana,Alumni Association,Missoula,MT,Y,1611
University of Montana Alumni Association,Alumni Association,Missoula,MT,Y,1612
University of Montevallo Alumni Association,Alumni Association,Montevallo,AL,Y,1613
University of Nebraska at Kearney Alumni Association,Alumni Association,Kearney,NE,Y,1614
University of Nebraska at Omaha Alumni Association,Alumni Association,Omaha,NE,Y,1615
University of Nebraska College of Medicine Alumni Association,Alumni Association,Omaha,NE,Y,1616
University of Nebraska Omaha Alumni Association,Alumni Association,Omaha,NE,Y,1617
University of Nebraska-Lincoln,Alumni Association,Lincoln,NE,Y,1618
University of Nevada Las Vegas Alumni Association,Alumni Association,Las Vegas,NV,Y,1619
"University of Nevada Las Vegas Alumni Association, Inc.",Alumni Association,Las Vegas,NV,Y,1620
University of Nevada Reno Foundation,Foundation,Reno,NV,Y,1621
University of New England,University,Biddeford,ME,Y,1622
University of New England Osteopathic Medicine,University,Biddeford,ME,Y,1623
University of New Hampshire Alumni Association,Alumni Association,Durham,NH,Y,1624
University of New Haven,University,West Haven,CT,Y,1625
University of New Mexico,University,Albuquerque,NM,Y,1626
University of New Mexico Alumni Association,Alumni Association,Albuquerque,NM,Y,1627
University of New Orleans International Alumni Association,Alumni Association,New Orleans,LA,Y,1628
University of New Orleans National Alumni Association,Alumni Association,New Orleans,LA,Y,1629
University of North Alabama,Alumni Association,Florence,AL,Y,1630
University of North Alabama Alumni Association,Alumni Association,Florence,AL,Y,1631
University of North Alabama National Alumni Association,Alumni Association,Florence,AL,Y,1632
"University of North Carolina at Asheville Foundation, Inc.",Foundation,Asheville,NC,Y,1633
University of North Carolina at Pembroke,University,Pembroke,NC,Y,1634
University of North Carolina Greensboro Alumni Association,Alumni Association,Greensboro,NC,Y,1635
University of North Carolina-Pembroke,University,Pembroke,NC,Y,1636
University of North Dakota,Alumni Association,Grand Forks,ND,Y,1637
University of North Dakota Alumni Association ,Alumni Association,Grand Forks,ND,Y,1639
University of North FL,Alumni Association,Jacksonville,FL,Y,1640
University of North Florida Alumni Association,Alumni Association,Jacksonville,FL,Y,1641
"University of North Florida Foundation, Inc.",Foundation,Jacksonville,FL,Y,1642
University of North Texas Alumni Association,Alumni Association,Denton,TX,Y,1643
University of Northern Colorado Alumni Association,Alumni Association,Greeley,CO,Y,1644
University of Northern Iowa Alumni Association,Alumni Association,Cedar Falls,IA,Y,1645
"University of Notre Dam du Lac and Play by Play Sports, LLC d/b/a Notre Dame Sports Properties","University, Other",Notre Dame,IN,Y,1646
University of Notre Dame,University,Notre Dame,IN,Y,1647
University of Notre Dame du Lac,University,Notre Dame,IN,Y,1648
University of Oklahoma,University,Norman,OK,Y,1649
"University of Oregon Alumni Association, Inc.  ",Alumni Association,Eugene,OR,Y,1652
University of Phoenix Alumni Association,Alumni Association,Phoenix,AZ,Y,1653
University of Phoenix Alumni Network,Alumni Association,Phoenix,AZ,Y,1654
University of Pittsburgh of the Commonwealth System of Higher Education,University,Pittsburgh,PA,Y,1655
University of Portland,University,Portland,OR,Y,1656
University of Puerto Rico,University,San Juan,PR,Y,1657
University of Redlands,University,Redlands,CA,Y,1658
University of Rhode Island Alumni Association,Alumni Association,Kingston,RI,Y,1659
University of Richmond,University,Richmond,VA,Y,1660
University of San Diego Alumni Association,Alumni Association,San Diego,CA,Y,1661
University of San Francisco,University,San Francisco,CA,Y,1662
University of Scranton ,University,Scranton,PA,Y,1663
University of Scranton Alumni Society,Alumni Association,Scranton,PA,Y,1664
University of SE Louisiana,Alumni Association,Hammond,LA,Y,1665
University of South Alabama,Alumni Association,Mobile,AL,Y,1666
University of South Alabama National Alumni Association,Alumni Association,Mobile,AL,Y,1667
University of South Carolina Alumni Association,Alumni Association,Columbia,SC,Y,1668
University of South Dakota Alumni Association,Foundation,Vermillion,SD,Y,1669
University Of South Florida,Alumni Association,Tampa,FL,Y,1670
University of South Florida,University,Tampa,FL,Y,1671
University of South Florida Alumni Association,Alumni Association,Tampa,FL,Y,1672
"University of South Florida Alumni Association, Inc.",Alumni Association,Tampa,FL,Y,1673
University of South Florida Alumni AssociationInc,Alumni Association,Tampa,FL,Y,1674
University of Southern California,University,Los Angeles,CA,Y,1675
University of Southern California,Alumni Association,Los Angeles,CA,Y,1676
University of Southern California Alumni Association,Alumni Association,Los Angeles,CA,Y,1677
University of Southern Indiana Alumni Association,Alumni Association,Evansville,IN,Y,1678
University of Southern Maine,University,Portland,ME,Y,1679
University of Southern Maine Foundation,Foundation,Portland,ME,Y,1680
University of Southern Maine Foundation (USM),Foundation,Portland,ME,Y,1681
University of Southern Mississippi Alumni Association,Alumni Association,Hattiesburg,MS,Y,1682
University of Southern Mississippi Alumni Association Inc,Alumni Association,Hattiesburg,MS,Y,1683
University of Southern Mississippi Alumni AssociationInc,Alumni Association,Hattiesburg,MS,Y,1684
University of St Thomas,University,Houston,TX,Y,1685
University of St. Francis,University,Joliet,IL,Y,1686
University of Tampa National Alumni Association,Alumni Association,Tampa,FL,Y,1688
University of Tennessee,University,Knoxville,TN,Y,1689
University of Texas at Arlington,University,Arlington,TX,Y,1690
University of Texas at Arlington Alumni Association,Alumni Association,Arlington,TX,Y,1691
University of Texas at Dallas,Alumni Association,Richardson,TX,Y,1692
University of Texas at Dallas Alumni Association,Alumni Association,Dallas,TX,Y,1693
University of Texas at Dallas Alumni Association,Alumni Association,Richardson,TX,Y,1694
University of Texas at El Paso Alumni Association,Alumni Association,El Paso,TX,Y,1695
University of Texas at San Antonio Alumni Association,Alumni Association,San Antonio,TX,Y,1696
University of Texas at Tyler Alumni Association,Alumni Association,Tyler,TX,Y,1697
University of Texas at Tyler Foundation,University,Tyler,TX,Y,1698
University of Texas Dental Branch Alumni Association,Alumni Association,Houston,TX,Y,1699
University of Texas Medical School Houston Alumni Association,Alumni Association,Houston ,TX,Y,1700
"University of Texas Pan American Alumni Association, Inc.",Alumni Association,Edinburg,TX,Y,1702
University of Texas Pan American Alumni AssociationInc,Alumni Association,Edinburg,TX,Y,1703
University of Texas San Antonio Alumni Association,Alumni Association,San Antonio,TX,Y,1704
University of Texas Tyler Foundation,Foundation,Tyler,TX,Y,1705
University of the Arts,University,Philadelphia,PA,Y,1706
University of the Incarnate Word,University,San Antonio,TX,Y,1707
University of the Pacific,University,Stockton,CA,Y,1708
University of the Sciences in Philadelphia,University,Philadelphia,PA,Y,1709
"University of Toledo Alumni Association, Inc.",Alumni Association,Toledo,OH,Y,1711
University of Toledo Alumni AssociationInc,Alumni Association,Toledo,OH,Y,1712
University of Tulsa,University,Tulsa,OK,Y,1713
University of Tulsa,Alumni Association,Tulsa,OK,Y,1714
University of Tulsa Alumni Association,Alumni Association,Tulsa,OK,Y,1715
University of Utah,University,Salt Lake City,UT,Y,1716
University of Utah,"University, Other",Salt Lake City,UT,Y,1717
University of Utah Alumni Association,Alumni Association,Salt Lake City,UT,Y,1718
University of Utah Alumni Association,Alumni Association,West Jordan,UT,Y,1719
University of Utah Alumni Association Association,Alumni Association,Salt Lake City,UT,Y,1720
University of Utah and CBS Collegiate Sports Properties Inc. ,"University, Other",Salt Lake City,UT,Y,1721
University of Utah and OUTFRONT MEDIA SPORTS INC.,"University, Other",Salt Lake City,UT,Y,1722
"University of Utah and UTES SPORTS PROPERTIES, LLC","University, Other",Salt Lake City,UT,Y,1723
University of Utah Athletics Department,University,Salt Lake City,UT,Y,1724
University of Utah Athletics Department and University of Utah Alumni Association,"Alumni Association, University",Salt Lake City,UT,Y,1725
University of Vermont,Alumni Association,Burlington,VT,Y,1726
University of Vermont and State Agricultural College,University,Burlington,VT,Y,1728
University of Vermont-Burlington,Foundation,Burlington,VT,Y,1729
University of Washington Alumni Association,Alumni Association,Seattle,WA,Y,1730
University of West Florida,Foundation,Pensacola,FL,Y,1731
University of West Florida Foundation,Foundation,Pensacola,FL,Y,1732
University of West Florida Foundation Inc,Foundation,Pensacola ,FL,Y,1734
"University of West Florida Foundation, Inc.",Foundation,Pensacola,FL,Y,1735
University of West Georgia,Alumni Association,Fayetteville,GA,Y,1736
"University of West Georgia Foundation, Inc.",Foundation,Carrollton,GA,Y,1737
University of Western Ontario,University,London,ON,Y,1738
University of WI - Eau Claire,Foundation,Eau Claire,WI,Y,1739
University of WI - MKE,Alumni Association,Milwaukee,WI,Y,1740
University of Wisc at Stevens Point,Alumni Association,Stevens Point,WI,Y,1741
University of Wisconsin Eau Claire Foundation,Foundation,Eau Claire,WI,Y,1742
University of Wisconsin Foundation,Foundation,Madison,WI,Y,1743
University of Wisconsin Green Bay Alumni Association,Alumni Association,Green Bay,WI,Y,1744
University of Wisconsin La Crosse Alumni Association,Alumni Association,La Crosse,WI,Y,1745
University of Wisconsin Milwaukee Alumni Association,Alumni Association,Milwaukee,WI,Y,1746
University of Wisconsin Milwaukee Alumni Association ,Alumni Association,Milwaukee,WI,Y,1747
University of Wisconsin Oshkosh Alumni Association,Alumni Association,Oshkosh,WI,Y,1748
University of Wisconsin Oshkosh Foundation ,Foundation,Oshkosh,WI,Y,1749
"University of Wisconsin Oshkosh Foundation, Inc.",Foundation,Oshkosh,WI,Y,1750
University of Wisconsin Parkside Alumni Association,Alumni Association,Kenosha,WI,Y,1751
University of Wisconsin Platteville Alumni Association,Alumni Association,Platteville,WI,Y,1752
University of Wisconsin Stevens Point Alumni Association,Alumni Association,Stevens Point,WI,Y,1753
University of Wisconsin Superior Alumni Association,Alumni Association,Superior,WI,Y,1754
University of Wisconsin Whitewater Foundation ,Foundation,Whitewater,WI,Y,1755
University of Wisconsin-Green Bay Alumni Association,Alumni Association,Green Bay,WI,Y,1756
University of Wisconsin-La Crosse Alumni Association,Alumni Association,La Crosse,WI,Y,1757
University of Wisconsin-Milwaukee Alumni Association,Alumni Association,Milwaukee,WI,Y,1758
University of Wisconsin-Parkside Alumni Association,Alumni Association,Kenosha,WI,Y,1759
University of Wisconsin-Platteville Alumni Association,Alumni Association,Platteville,WI,Y,1760
University of Wisconsin-Stevens Point Alumni Association and Foundation,"Alumni Association, Foundation",Stevens Point,WI,Y,1761
University of Wisconsin-Stevens Point Alumni Associationand Foundation,Alumni Association,Stevens Point,WI,Y,1762
University of Wisconsin-Superior Alumni Association,Alumni Association,Superior,WI,Y,1763
University of Wisconsin-Whitewater Foundation ,Foundation,Whitewater,WI,Y,1764
"University of Wisconsin-Whitewater Foundation, Inc.",Foundation,Whitewater,WI,Y,1765
University of Wyoming Alumni Association ,Alumni Association,Laramie ,WY,Y,1768
University System of Maryland Foundation,Foundation,Adelphi,MD,Y,1770
Upper Iowa University,University,Fayette,IA,Y,1771
Ursinus College,University,Collegeville,PA,Y,1772
USF Alumni Association,University,Tampa,FL,Y,1773
USF Alumni Association,Alumni Association,Tampa,FL,Y,1774
Utah State University,University,Ogden,UT,Y,1775
Utah Valley State College,University,Orem,UT,Y,1776
Utica College,University,Utica,NY,Y,1777
Valdosta State University,Alumni Association,Valdosta,GA,Y,1778
Valdosta State University Alumni ,Alumni Association,Valdosta,GA,Y,1779
Valdosta State University Alumni Association,Alumni Association,Valdosta,GA,Y,1780
Valparaiso University,Alumni Association,Valparaiso,IN,Y,1781
Valparaiso University Alumni Association,Alumni Association,Valparaiso,IN,Y,1782
Vassar College,University,Poughkeepsie,NY,Y,1783
Vaughn College of Aeronautics and Technology,University,Flushing,NY,Y,1784
Villanova University,University,Villanova,PA,Y,1785
Virginia Commonwealth University Alumni ,Alumni Association,Richmond,VA,Y,1786
Virginia Commonwealth University Alumni Association,Alumni Association,Richmond,VA,Y,1787
Virginia Commonwealth University Alumni Associationand The Medical College of Virginia Alumni Associationof Virginia Commonwealth University,Alumni Association,Richmond,VA,Y,1788
Virginia Military Institute Alumni Association,Alumni Association,Lexington,VA,Y,1789
"Virginia Military Institute Alumni Association, Inc.",Alumni Association,Lexington,VA,Y,1790
Virginia State University Alumni Association,Alumni Association,St. Stephens Church,VA,Y,1791
Virginia Tech Alumni Association,Alumni Association,Blacksburg,VA,Y,1792
Virginia Tech University,Alumni Association,Blacksburg,VA,Y,1793
VMI Alumni Association,Alumni Association,Lexington,VA,Y,1794
"VMI Alumni Association, Inc.",Alumni Association,Lexington,VA,Y,1795
Wagner College ,University,Staten Island,NY,Y,1796
Wake Forest University,University,Winston-Salem,NC,Y,1797
Wake Forest University,University,Winston Salem,NC,Y,1798
Walla Walla College,University,College Place,WA,Y,1799
Wartburg College,University,Waverly,IA,Y,1800
Washburn University ,University,Topeka,KS,Y,1802
Washington and Lee University,University,Lexington,VA,Y,1803
Washington and Lee University,Other,Lexington,VA,Y,1804
Washington College,University,Chestertown,MD,Y,1805
Washington State University Alumni Association,Alumni Association,Pullman,WA,Y,1806
Washington University,University,St. Louis,MO,Y,1807
Washington University,University,Saint Louis,MO,Y,1808
Water Environment Federation,Other,Alexandria,VA,Y,1809
Wayland Baptist University,University,Plainview,TX,Y,1810
Wayne State Foundation,Foundation,Wayne,NE,Y,1811
Wayne State University,Alumni Association,Detroit,MI,Y,1812
Wayne State University Alumni Assocation ,Alumni Association,Detroit,MI,Y,1813
Wayne State University Alumni Association,Alumni Association,Detroit,MI,Y,1814
Waynesburg College,University,Waynesburg,PA,Y,1816
Waynesburg University,University,Waynesburg,PA,Y,1817
Weber State,Alumni Association,Ogden,VT,Y,1818
Weber State Alumni Association ,Alumni Association,Ogden,VT,Y,1820
Weber State University Alumni Association,Alumni Association,Ogden,UT,Y,1821
Webster University,"Alumni Association, University",Webster Groves,MO,Y,1822
Webster University,Alumni Association,Webster Groves,MO,Y,1823
Webster University Alumni Association,Alumni Association,St. Louis,MO,Y,1824
Wellesley College Alumnae Association,Alumni Association,Wellesley,MA,Y,1825
Wesley College,University,Dover,DE,Y,1826
Wesleyan College,University,Macon,GA,Y,1827
West Chester University Alumni Association,Alumni Association,West Chester,PA,Y,1829
West Chester University of PA,Other,West Chester,PA,Y,1830
West Liberty State College Alumni Association,Alumni Association,West Liberty,WV,Y,1831
West Point Association of Graduates,Alumni Association,West Point,NY,Y,1832
West Texas A&M University Alumni Association,Alumni Association,Canyon,TX,Y,1833
West Virginia State University,University,Institute,WV,Y,1834
West Virginia University Alumni Association,Alumni Association,Morgantown,WV,Y,1835
West Virginia Wesleyan College,University,Buckhannon,WV,Y,1836
Western Carolina University Alumni Association,Alumni Association,Cullowhee,NC,Y,1837
Western Connecticut State University,University,Danbury,CT,Y,1838
Western Illinois University Alumni Association,Alumni Association,Macomb,IL,Y,1839
Western Illinois University Foundation ,Alumni Association,Macomb,IL,Y,1840
Western Kentucky University Alumni Association,Alumni Association,Bowling Green,KY,Y,1841
Western Michigan Alumni Assocation,Alumni Association,Kalamazoo,MI,Y,1842
Western Michigan University ,Alumni Association,Kalamazoo,MI,Y,1843
Western Michigan University Alumni Association,Alumni Association,Kalamazoo,MI,Y,1844
Western New England College,University,Springfield,MA,Y,1845
Western New England College School of Law,University,Springfield,MA,Y,1846
Western Oregon University Development Foundation ,Foundation,Monmouth,OR,Y,1848
Western State College Alumni Association,Alumni Association,Gunnison,CO,Y,1849
Western State University Alumni Association,Alumni Association,Fullerton,CA,Y,1850
Western Washington University Alumni Association,Alumni Association,Bellingham,WA,Y,1851
Westfield State College ,Foundation,Westfield,MA,Y,1852
"Westfield State College Foundation, Inc. ",Foundation,Westfield,MA,Y,1854
Westminster College,University,Fulton,MO,Y,1855
Westminster College ,University,New Wilmington,PA,Y,1856
Westminster College New Wilmington,University,New Wilmington,PA,Y,1857
Wheeling Jesuit University,University,Wheeling,WV,Y,1858
Whittier College,University,Whittier,CA,Y,1859
Whos Who Among Students in American Universities and Colleges,Other,Tuscaloosa,AL,Y,1860
Who's Who Among Students in American Universities and Colleges,Other,Tuscaloosa,AL,Y,1861
"Wichita State University Alumni Association, Inc. ",Alumni Association,Wichita,KS,Y,1863
Widener University,University,Chester,PA,Y,1865
Widener University School of Law,University,Chester,DE,Y,1867
Wildlife Society,Other,Bethesda,MD,Y,1868
Wilkes University,University,Wilkes-Barre,PA,Y,1869
Willamette University,University,Salem,OR,Y,1870
William & Mary University,Alumni Association,Williamsburg,VA,Y,1871
William and Mary Alumni Association,Alumni Association,Williamsburg,VA,Y,1872
William Jewell College,University,Liberty,MO,Y,1873
William Jewell College,Alumni Association,Liberty ,MO,Y,1875
William Marsh Rice University,University,Houston,TX,Y,1876
William Paterson University Alumni Association,Alumni Association,Wayne ,NJ,Y,1878
Wilmington College,University,Wilmington,OH,Y,1879
Wilmington University Inc,University,New Castle,DE,Y,1880
"Wilmington University, Inc.",University,New Castle,DE,Y,1881
Wilson College,University,Chambersburg,PA,Y,1882
Wilson College,Alumni Association,Chambersburg,PA,Y,1883
Wingate University,University,Wingate,NC,Y,1884
Winona State University Alumni Association,Alumni Association,Winona,MN,Y,1885
Wisconsin Alumni Association,Alumni Association,Madison,WI,Y,1886
Wisconsin Alumni Association (UW-Madison),Alumni Association,Madison,WI,Y,1887
Wofford College,University,Spartanburg,SC,Y,1888
Worcester Polytechnic Institute Alumni Association,Alumni Association,Worcester,MA,Y,1889
Worcester Polytechnic Institute Alumni Association (WPI Alumni Assn),Alumni Association,Worcester,MA,Y,1890
Worcester Polytechnic Institute Alumni Association(WPI Alumni Assn),Alumni Association,Worcester,MA,Y,1891
Worcester State College,University,Worcester,MA,Y,1892
Wright State University Alumni Association,Alumni Association,Dayton,OH,Y,1893
Wright State University Alumni Association,Alumni Association,Fairborn,OH,Y,1894
Xi Psi Phi,Other,Alton,IL,Y,1895
Yale University ,University,New Haven,CT,Y,1897
"York College Alumni, Inc.",Alumni Association,Jamaica,NY,Y,1898
York College of Pennsylvania,University,York,PA,Y,1899
Youngstown State University,University,Youngstown,OH,Y,1900
Youngstown State University,Alumni Association,Youngstown,OH,Y,1901
