institution_name,inst_type_name,institution_city,state_abbv,active_ind,display_order
Midwestern State University Ex-Students Association,Alumni Association,Wichita Falls,TX,Y,782
Millersville,Alumni Association,Millersville,PA,Y,783
Millersville University Alumni Association,Alumni Association,Millersville,PA,Y,784
Millersville University of Pennsylvania,University,Millersville,PA,Y,785
Milligan College Alumni Association,Alumni Association,Milligan College,TN,Y,786
Miner Alumni Association(MO University of S&T),Alumni Association,Rolla,MO,Y,787
"Minerals, Metals and Materials Society, Inc.",Other,Warrendale,PA,Y,788
Minnesota State University Mankato Foundation Inc,Foundation,Mankato,MN,Y,789
Minnesota State University Moorhead Alumni Association,Alumni Association,Moorhead,MN,Y,790
"Minnesota State University, Mankato Foundation, Inc.",Foundation,Mankato,MN,Y,791
Mississippi State University Alumni Association,Alumni Association,Mississippi State,MS,Y,792
Mississippi Valley State University,University,Itta Bena,MS,Y,793
Missouri State University Foundation,Foundation,Springfield,MO,Y,794
MIT Alumni Association,Alumni Association,Cambridge,MA,Y,795
Monmouth College,University,Monmouth,IL,Y,796
Monmouth University,University,West Long Branch,NJ,Y,797
Montana State University Alumni Association,Alumni Association,Bozeman,MT,Y,798
Montana State University at Billings Alumni Association,Alumni Association,Billings,MT,Y,799
Montana State University-Northern Foundation and Montana State University-Northern Alumni Association,"Alumni Association, Foundation",Havre,MT,Y,800
Montana State University-Northern Foundation and Northern Alumni Association,"Alumni Association, Foundation",Havre,MT,Y,801
Montana Tech Foundation,Foundation,Butte ,MT,Y,802
Montclair State University Alumni Association,Alumni Association,Upper Montclair,NJ,Y,803
Moravian College,University,Bethlehem,PA,Y,804
Morehead State University Alumni Association,Alumni Association,Morehead,KY,Y,805
"Morehead State University Alumni Association, Inc.",Alumni Association,Morehead,KY,Y,806
Morehead State University Alumni AssociationInc.,Alumni Association,Morehead,KY,Y,807
Morehouse College Alumni Association,Alumni Association,Atlanta,GA,Y,808
Morehouse School of Medicine,Alumni Association,Atlanta ,GA,Y,809
Morehouse School of Medicine National Alumni Association,Alumni Association,Atlanta,GA,Y,810
Morgan State University National Alumni Association,Alumni Association,Baltimore,MD,Y,811
Morris Brown College National Alumni Association,Alumni Association,Atlanta,GA,Y,812
Morrisville College Foundation,Foundation,Morrisville,NY,Y,813
Mortar Board Foundation Fund,Foundation,Columbus,OH,Y,815
Mortar Board Inc.,Other,Columbus ,OH,Y,817
Mount Saint Marys College,University,Los Angeles,CA,Y,818
Mount Saint Mary's College,University,Los Angeles,CA,Y,819
Mount Saint Marys College Maryland,University,Emmitsburg,MD,Y,820
"Mount Sinai Alumni, Inc.",Alumni Association,New York,NY,Y,821
Mount St. Mary's College,University,Los Angeles,CA,Y,822
Mount St. Mary's University ,University,Emmitsburg,MD,Y,824
Mountain State University Alumni Association,Alumni Association,Beckley,WV,Y,825
"Mountain State University, Inc.",University,Beckley,WV,Y,826
MSM-UMR Alumni Association,Alumni Association,Rolla,MO,Y,827
Mu Phi Epsilon Fraternity,Other,Long Beach,CA,Y,828
Murray State,Alumni Association,Murray,KY,Y,829
Murray State University ,Alumni Association,Murray,KY,Y,830
Murray State University Alumni Association,Alumni Association,Murray,KY,Y,831
Music Educators National Conference MENC,Other,Reston,VA,Y,832
NACE International,Other,Houston,TX,Y,833
National Alumnae Association of Spelman College Inc,Alumni Association,Atlanta,GA,Y,834
"National Alumnae Association of Spelman College, Inc.",Alumni Association,Atlanta,GA,Y,835
National Alumni Association of the University of Alabama,Alumni Association,Tuscaloosa,AL,Y,836
National Alumni Associationof the Tennessee State University,Alumni Association,Nashville,TN,Y,837
National Alumni Associationof the University of Alabama,Alumni Association,Tuscaloosa,AL,Y,838
National Association of School Psychologists,Other,Bethesda,MD,Y,839
National Athletic Trainers  Association,Other,Dallas,TX,Y,840
"National Athletic Trainers  Association, Inc.",Other,Dallas,TX,Y,841
"National Athletic Trainers'  Association, Inc.",Other,Dallas,TX,Y,842
National Deans List Graduate,Other,Austin,TX,Y,843
National Dental Association,Other,Washington,DC,Y,844
National Lawyers Guild,Other,New York,NY,Y,845
National Louis University,University,Evanston,IL,Y,846
National Science Teachers Association,Other,Arlington,VA,Y,847
National Society of Black Engineers,Other,Alexandria,VA,Y,848
National Society of Collegiate Scholars,Other,Washington,DC,Y,849
National Student Nurses Association,University,Brooklyn,NY,Y,850
National Student Speech Language Hearing Association,Other,Rockville,MD,Y,851
National University,University,La Jolla,CA,Y,852
National-Louis University,University,Evanston,IL,Y,853
NCPA Foundation,Foundation,Alexandria,VA,Y,854
New England College Alumni Association,Alumni Association,Henniker,NH,Y,855
New England Institute of Technology,University,Warwick ,RI,Y,856
New England School of Law,University,Boston,MA,Y,858
New Jersey City University Foundation,Foundation,Jersey City,NJ,Y,859
New Mexico Highlands University Alumni Association,Alumni Association,Las Vegas,NM,Y,860
New Mexico Military Institute,Alumni Association,Roswell,NM,Y,861
"New Mexico Military Institute Alumni Association, Inc.",Alumni Association,Roswell,NM,Y,862
New Mexico State University Alumni Association,Alumni Association,Las Cruces,NM,Y,863
New York City College of Technology Alumni Association,Alumni Association,Brooklyn,NY,Y,864
New York Film Academy,University,New York,NY,Y,865
New York Law School Alumni Association,Alumni Association,New York,NY,Y,866
New York Medical College Alumni Association,Alumni Association,Valhalla,NY,Y,867
New York University ,University,New York,NY,Y,869
New York University Alumni Association,Alumni Association,New York,NY,Y,870
New York Women in Communications Foundation,Foundation,New York,NY,Y,871
Newberry College,University,Newberry,SC,Y,872
Newman University Alumni Association,Alumni Association,Wichita,KS,Y,873
Niagara University,University,Niagara,NY,Y,874
Nicholls State University Alumni Federation,Alumni Association,Thibodaux,LA,Y,875
NLN Foundation for Nursing Education,Foundation,New York,NY,Y,876
North Carolina Agricultural and Technical State University,University,Greensboro,NC,Y,877
North Carolina Central University Alumni Association,Alumni Association,Durham,NC,Y,878
North Carolina State University,Alumni Association,Raleigh,NC,Y,879
North Carolina State University Alumni Association,Alumni Association,Raleigh,NC,Y,880
North Carolina University of Greensboro,Alumni Association,Greensboro,NC,Y,881
North Dakota State Alumni Association,Alumni Association,Fargo,ND,Y,882
North Dakota State University,Alumni Association,Fargo,ND,Y,883
North Dakota State University Alumni Association,Alumni Association,Fargo,ND,Y,884
North Georgia College & State University Alumni Association,Alumni Association,Dahlonega,GA,Y,885
North Georgia College and State University Alumni Association,Alumni Association,Dahlonega,GA,Y,886
North Greenville University,University,Tigerville,SC,Y,887
North Park University,University,Chicago,IL,Y,888
North Texas Alumni Association ,Alumni Association,Denton,TX,Y,889
North Texas Exes,Alumni Association,Denton,TX,Y,890
Northampton Community College,University,Bethlehem ,PA,Y,891
Northampton Community College Monroe Campus,University,Tannersville,PA,Y,892
Northeast Lousiana University Alumni Association,Alumni Association,Monroe,LA,Y,893
"Northeast Triskelion, Inc",Other,New York,NY,Y,894
Northeastern Illinois University  ,University,Chicago,IL,Y,896
Northeastern Illinois University Foundation,University,Chicago,IL,Y,897
Northeastern State University Foundation Inc,Foundation,Tahlequah,OK,Y,898
"Northeastern State University Foundation, Inc.",Foundation,Tahlequah,OK,Y,899
Northeastern University,University,Boston,MA,Y,900
Northern Arizona University Alumni Association,Alumni Association,Flagstaff,AZ,Y,901
Northern Illinois Alumni Association,Alumni Association,DeKalb,IL,Y,902
Northern Illinois University,Alumni Association,DeKalb,IL,Y,903
Northern Illinois University Alumni Association,Alumni Association,DeKalb,IL,Y,904
Northern Kentucky University,Alumni Association,Highland Heights,KY,Y,905
Northern Kentucky University Foundation,Foundation,Highland Heights,KY,Y,906
Northern Virginia Community College Educational Foundation,Foundation,Annandale,VA,Y,907
Northwest College Foundation,Foundation,Powell,WY,Y,909
Northwest Missouri State University Alumni Association,Alumni Association,Maryville,MO,Y,910
Northwest University,University,Kirkland,WA,Y,911
Northwestern State University Alumni Association,Alumni Association,Natchitoches,LA,Y,912
Northwestern University,University,Evanston,IL,Y,913
Northwood University,University,Midland ,MI,Y,914
Norwich University ,Alumni Association,Northfield,VT,Y,916
Norwich University Alumni Association,Alumni Association,Northfield,VT,Y,917
NW Missouri State University,Alumni Association,Maryville,MO,Y,918
Oakland University,University,Rochester,MI,Y,919
Oakland University,University,Oakland,MI,Y,920
Oglethorpe University Alumni Association,Alumni Association,Atlanta,GA,Y,921
Ohio College of Podiatric Medicine,University,Cleveland,OH,Y,922
Ohio Dominican College,University,Columbus,OH,Y,923
Ohio Northern University,Alumni Association,Ada,OH,Y,924
Ohio Northern University Alumni Association,Alumni Association,Ada,OH,Y,925
Ohio State Bar Association,Other,Columbus,OH,Y,926
"Ohio State University Alumni Association, Inc.",Alumni Association,Columbus,OH,Y,927
Ohio University Alumni Association,Alumni Association,Athens,OH,Y,928
Ohio University Foundation,Foundation,Athens,OH,Y,929
Ohio Wesleyan University,University,Delaware,OH,Y,930
Oklahoma State University Alumni Assn,Alumni Association,Stillwater,OK,Y,931
Oklahoma State University Alumni Association,Alumni Association,Stillwater,OK,Y,932
Old Dominion University Alumni Association ,Alumni Association,Norfolk,VA,Y,934
"Old Dominion University Alumni Association, Inc.",Alumni Association,Norfolk,VA,Y,935
Ole Miss Alumni Association,Alumni Association,Oxford,MS,Y,936
"Omega Psi Phi Fraternity, Inc.",Other,Decatur,GA,Y,937
Omicron Delta Kappa,Other,Lexington,VA,Y,938
"Omicron Delta Kappa Society, Inc.",Other,Lexington,VA,Y,940
Oral Roberts University Alumni Foundation,Foundation,Tulsa,OK,Y,941
Oregon Health Sciences University Alumni Associations,Alumni Association,Portland,OR,Y,942
Oregon Institute of Technology,University,Klamath Falls,OR,Y,943
Oregon State University Alumni Association,Alumni Association,Corvallis,OR,Y,944
"Oregon State University Alumni Association, Inc.",Alumni Association,Corvallis,OR,Y,945
Osteopathic Physicians and Surgeons of California,Other,Sacramento,CA,Y,946
Oswego Alumni Association ,Alumni Association,Oswego,NY,Y,948
Oswego Alumni Association Inc,Alumni Association,Oswego,NY,Y,949
"Oswego Alumni Association, Inc.",Alumni Association,Oswego,NY,Y,950
Otterbein College,University,Westerville,OH,Y,951
Oxford Limited ,University,Oxford,UK,Y,953
Pace University,University,New York,NY,Y,954
Palmer College of Chiropractic Alumni Association,Alumni Association,Davenport,IA,Y,955
"PanIIT, Inc.",Other,Cupertino,CA,Y,957
Park University,University,Kansas City,MO,Y,958
Park University,University,Parkville,MO,Y,959
Parker School for Professional Success,University,Dallas,TX,Y,960
Peirce College,University,Philadelphia,PA,Y,961
Penn State Alumni Association,Alumni Association,University Park,PA,Y,962
Penn State Alumni Association,Alumni Association,State College,PA,Y,963
Pennsylvania College of Optometry,University,Philadelphia,PA,Y,964
Pennsylvania Pharmacists Association,Other,Harrisburg,PA,Y,965
Pensacola State College,University,Pensacola,FL,Y,966
Pepperdine,Alumni Association,Malibu,CA,Y,967
Pepperdine University Alumni Association,Alumni Association,Malibu,CA,Y,968
Phi Alpha Delta Law Fraternity International,Other,Baltimore,MD,Y,969
Phi Chi Medical Fraternity,Other,New Albany,IN,Y,970
Phi Chi Theta,Other,Lufkin,TX,Y,971
Phi Delta Chi,Other,South Lyon,MI,Y,972
Phi Delta Chi,Other,Arlington,VA,Y,973
Phi Delta Epsilon Medical Fraternity Inc,Other,Alpena ,MI,Y,974
"Phi Delta Epsilon Medical Fraternity, Inc.",Other,Hollywood,FL,Y,975
Phi Delta Kappa International,Other,Bloomington,IN,Y,977
"Phi Delta Kappa International, Inc.",Other,Bloomington,IN,Y,978
Phi Delta Theta Fraternity,Other,Oxford,OH,Y,979
Phi Epsilon Kappa,Other,Indianapolis,IN,Y,980
Phi Eta Sigma,Other,Bowling Green,KY,Y,981
Phi Gamma Nu,Other,Seven Hills,OH,Y,982
Phi Kappa Phi,Other,Baton Rouge,LA,Y,983
Phi Kappa Phi Honor Society,Other,Baton Rouge,LA,Y,984
Phi Kappa Psi,Other,Indianapolis,IN,Y,985
Phi Kappa Sigma International Fraternity,Other,Chester Springs,PA,Y,986
Phi Kappa Sigma Intl. Fraternity,Other,Chester Springs,PA,Y,987
Phi Kappa Tau Fraternity,Other,Oxford,OH,Y,988
Phi Kappa Theta National Fraternity,Other,Carmel,IN,Y,989
"Phi Lota Alpha Fraternity, Inc.",Other,Brooklyn,NY,Y,990
Phi Mu ,Other,Tucker,GA,Y,992
Phi Mu Alpha Sinfonia Fraternity of America Inc,Other,Evansville,IN,Y,993
"Phi Mu Alpha Sinfonia Fraternity of America, Inc.",Other,Evansville,IN,Y,994
Phi Mu Fraternity,Other,Tucker,GA,Y,995
"Phi Rho Eta Fraternity, Inc.",Other,Chicago,IL,Y,996
Phi Rho Sigma Medical Society,Other,Indianapolis,IN,Y,997
Phi Sigma Pi,Other,Lancaster,PA,Y,998
Phi Sigma Sigma Foundation,Foundation,Elkridge,MD,Y,999
Phi Theta Kappa International Honor Society,Other,Jackson,MS,Y,1000
Philadelphia College of Pharmacy and Science,University,Philadelphia,PA,Y,1001
Pi Beta Phi Fraternity Inc,Other,Town & Country,MO,Y,1002
"Pi Beta Phi Fraternity, Inc.",Other,Town and Country,MO,Y,1003
Pi Kappa Alpha Corporation,Other,Memphis,TN,Y,1005
Pi Kappa Phi Foundation,Foundation,Charlotte,NC,Y,1006
Pi Lambda Phi ,Other,Danbury,CT,Y,1008
"Pi Lambda Phi Fraternity, Inc.",Other,Danbury,CT,Y,1009
Pi Sigma Epsilon Inc,Other,Hartland,WI,Y,1010
"Pi Sigma Epsilon, Inc.",Other,Hartland,WI,Y,1011
Pittsburg State University Alumni Association,Alumni Association,Pittsburg,KS,Y,1012
"Pittsburg State University Alumni Association, Inc. ",Alumni Association,Pittsburg,KS,Y,1013
"Pittsburg State Univesity Alumni Association, Inc. ",Alumni Association,Pittsburg,KS,Y,1014
Plymouth State College Alumni Association,Alumni Association,Plymouth,NH,Y,1015
Plymouth State University Alumni Association,Alumni Association,Plymouth,NH,Y,1016
Polytechnic Institute Alumni Association,Alumni Association,Brooklyn,NY,Y,1017
Polytechnic Institute Alumni Association,Alumni Association,New York,NY,Y,1018
"Polytechnic Institute Alumni Association, Inc.",Alumni Association,Brooklyn,NY,Y,1019
Polytechnic University Alumni Association,Alumni Association,Brooklyn,NY,Y,1020
Pontificia Universidad Católica,University,San Juan,PR,Y,1021
Pontificia Universidad Católica de Puerto Rico,University,Ponce,PR,Y,1022
Portland State University Alumni Association,Alumni Association,Portland,OR,Y,1023
"Potsdam College Foundation, Inc.",Foundation,Potsdam,NY,Y,1024
Prairie View A & M National Alumni Association,Alumni Association,Prairie View,TX,Y,1025
Prairie View A & M University/National Alumni Association,"Alumni Association, University",Prairie View,TX,Y,1026
Prairie View A and M University National Alumni Association,Alumni Association,Prairie View,TX,Y,1027
Prairie View A&M University - National Alumni Association,Alumni Association,Prairie View,TX,Y,1028
Prairie View A&M University/National Alumni Association,"Alumni Association, University",Prairie View,TX,Y,1029
Pratt Institute,University,Brooklyn,NY,Y,1030
Presbyterian College,University,Clinton,SC,Y,1031
President and Trustees of the Spring Hill College of the County of Mobile,University,Mobile,AL,Y,1032
Princeton University Alumni Association,Alumni Association,Princeton,NJ,Y,1033
Princeton University Store,Other,Princeton,NJ,Y,1034
Principia,University,St. Louis,MO,Y,1035
Project Management Institute,Other,Newton Square,PA,Y,1036
Providence College Alumni Association,Alumni Association,Providence,RI,Y,1038
Psi Omega Dental Fraternity,Other,Charleston,SC,Y,1039
Psi Upsilon Fraternity,Other,Indianapolis,IN,Y,1040
Purdue Alumni Association ,Alumni Association,West Lafayette,IN,Y,1042
Queens College Foundation,Foundation,Flushing,NY,Y,1043
Queen's University ,University,Kingston,ON,Y,1044
Queen's University at Kingston,University,Kingston,ON,Y,1045
Quincy University,University,Quincy,IL,Y,1046
Quinnipiac University,University,Hamden,CT,Y,1047
Quinnipiac University School of Law,University,Hamden,CT,Y,1048
Radford University Alumni Association,Alumni Association,Radford,VA,Y,1049
Ramapo College Foundation,Foundation,Mahwah,NJ,Y,1050
Randolph Macon Woman's College Alumnae Association,Alumni Association,Lynchburg,VA,Y,1051
Reading Area Community College,University,Reading,PA,Y,1052
Reading Area Community College,University,Lancaster,PA,Y,1053
Regents of  the University of Colorado,University,Boulder,CO,Y,1054
Regents of the University of Colorado,University,Denver,CO,Y,1055
Regents of the University of Colorado ,University,Colorado Springs,CO,Y,1056
"Regents of the University of Colorado, a Body Corporate",University,Boulder,CO,Y,1057
Regents of the University of Minnesota,University,Minneapolis,MN,Y,1058
Regis College,University,Weston,MA,Y,1059
Regis University Alumni Associatoin,Alumni Association,Denver,CO,Y,1060
Rensselaer Polytechnic,Alumni Association,Troy,NY,Y,1061
Rensselaer Polytechnic Institute Alumni Association,Alumni Association,Troy,NY,Y,1063
Rhode Island College,Alumni Association,Providence,RI,Y,1064
Rhode Island College Alumni Association,Alumni Association,Providence,RI,Y,1065
Rhode Island School of Design,University,Providence ,RI,Y,1066
Richard Stockton College of New Jersey,University,Pomona,NJ,Y,1069
Rider University,University,Lawrenceville,NJ,Y,1070
Robert Morris College Alumni Association,Alumni Association,Coraopolis,PA,Y,1071
Robert Morris University Alumni Association,Alumni Association,Coraopolis,PA,Y,1072
Rochester College,University,Rochester,MI,Y,1073
Rochester University (formally known as Rochester College),University,Rochester,MI,Y,1074
Rockhurst University,University,Kansas City,MO,Y,1075
Roger Williams University,University,Bristol,RI,Y,1077
Rollins College Alumni Association,Alumni Association,Winter Park,FL,Y,1078
"Rollins College Alumni Association, Inc.",Alumni Association,Winter Park,FL,Y,1079
Rose Hulman Institute of Technology,University,Terre Haute,IN,Y,1080
Rose-Hulman Institute of Technology,University,Terre Haute,IN,Y,1081
Rosemont College,University,Rosemont,PA,Y,1082
Rowan University Alumni Association and Rowan University Foundation,"Alumni Association, Foundation",Glassboro,NJ,Y,1083
Rowan University Alumni Association_Rowan University Foundation,Alumni Association,Glassboro,NJ,Y,1084
Russell Sage College Alumnae Association,Alumni Association,Troy,NY,Y,1085
Russell Sage College Alumni Association,Alumni Association,Troy,NY,Y,1086
Rutgers,Alumni Association,New Brunswick,NJ,Y,1087
"Rutgers University Alumni Federation and Rutgers, the State University of New Jersey","Alumni Association, University",New Brunswick,NJ,Y,1088
Rutgers University Foundation,Alumni Association,New Brunswick,NJ,Y,1089
Rutgers University Student and Alumni Federal Credit Union,Other,New Brunswick,NJ,Y,1090
Sacramento State Alumni Association,Alumni Association,Sacramento,CA,Y,1091
Sacred Heart University,University,Fairfield,CT,Y,1092
SAE International,Other,Warrendale,PA,Y,1093
Saginaw Valley State University,University,University Center,MI,Y,1094
Saint Anselm College,University,Manchester,NH,Y,1095
Saint Cloud State University Alumni Association,Alumni Association,Saint Cloud,MN,Y,1096
Saint Francis University,University,Loretto,PA,Y,1097
Saint Josephs College,University,Rensselaer,IN,Y,1098
Saint Joseph's College,University,Rensselaer,IN,Y,1099
Saint Josephs College Alumni Association,Alumni Association,Brooklyn,NY,Y,1100
Saint Joseph's College of Maine,University,Standish,ME,Y,1101
Saint Josephs University,University,Philadelphia,PA,Y,1102
Saint Joseph's University,University,Philadelphia,PA,Y,1103
Saint Leo University,University,Saint Leo,FL,Y,1104
Saint Louis University,University,St. Louis,MO,Y,1105
Saint Marys College of California,Alumni Association,Moranga,CA,Y,1106
Saint Mary's College of California,University,Moraga,CA,Y,1107
Saint Mary's College of California,Alumni Association,Moranga,CA,Y,1108
Saint Marys University of San Antonio Texas,University,San Antonio,TX,Y,1109
Saint Peter's College Alumni Association,Alumni Association,Jersey City,NJ,Y,1110
Saint Vincent College Alumni Association,Alumni Association,Latrobe,PA,Y,1111
Saint Xavier University,University,Chicago,IL,Y,1112
Salem State College Alumni Association,Alumni Association,Salem,MA,Y,1113
Salisbury University Alumni Association,Alumni Association,Saisbury,MD,Y,1114
Salisbury University Foundation Inc,Foundation,Salisbury,MD,Y,1115
"Salisbury University Foundation, Inc.",Foundation,Salisbury,MD,Y,1116
Sam Houston State University,University,Huntsville,TX,Y,1117
Samford University,University,Birmingham,AL,Y,1118
San Diego State University Campanile Foundation,Foundation,San Diego,CA,Y,1119
San Francisco State University,Foundation,San Francisco,CA,Y,1120
San Jose State University Alumni Association,Alumni Association,San Jose,CA,Y,1121
Santa Clara University,University,Santa Clara,CA,Y,1122
Seattle Pacific University,University,Seattle,WA,Y,1123
Seattle University,University,Seattle,WA,Y,1124
Seattle University,"Alumni Association, University",Seattle,WA,Y,1125
Seattle University,Alumni Association,Seattle,WA,Y,1126
Seminole Boosters Inc,Other,Tallahassee,FL,Y,1127
"Seminole Boosters, Inc.",Other,Tallahassee,FL,Y,1128
Seton Hall University,University,South Orange ,NJ,Y,1129
Shenandoah University,University,Winchester,VA,Y,1131
Shepherd College Alumni Association,Alumni Association,Shepherdstown,WV,Y,1132
Shippensburg University Foundation Inc,Foundation,Shippensburg,PA,Y,1133
"Shippensburg University Foundation, Inc.",Foundation,Shippensburg,PA,Y,1134
Shippensburg University of Pennsylvania,Other,Shippensburg,PA,Y,1135
"Shippensburg University Student Services, Inc.",Other,Shippensburg,PA,Y,1136
Shorter College Alumni Association,Alumni Association,Rome,GA,Y,1137
Siena College,University,Loudonville,NY,Y,1138
Sigma Alpha Epsilon Fraternity,Other,Evanston,IL,Y,1139
Sigma Alpha Iota International Music Fraternity,Other,Asheville,NC,Y,1140
Sigma Alpha Mu Fraternity,Other,Indianapolis,IN,Y,1141
Sigma Beta Delta,Other,St. Louis,MO,Y,1142
Sigma Chi,Other,Evanston,IL,Y,1143
Sigma Chi Foundation,Foundation,Evanston,IL,Y,1144
Sigma Chi Foundation,Other,Evanston,IL,Y,1145
Sigma Kappa Sorority,Other,Indianapolis,IN,Y,1146
Sigma Nu Fraternity Inc,Other,Lexington,VA,Y,1147
"Sigma Nu Fraternity, Inc.",Other,Lexington,VA,Y,1148
Sigma Phi Delta Fraternity,Other,Rockford,IL,Y,1149
"Sigma Phi Epsilon Fraternity, Inc.",Other,Richmond,VA,Y,1150
Sigma Pi Fraternity International Inc,Other,Vincennes,IN,Y,1151
"Sigma Pi Fraternity International, Inc.",Other,Vincennes,IN,Y,1152
"Sigma Pi Fraternity International, Inc.",Other,Vincennes,IA,Y,1153
Sigma Sigma Sigma,Other,Woodstock,VA,Y,1154
Sigma Tau Gamma Fraternity Inc,Other,Warrensburg,MO,Y,1155
"Sigma Tau Gamma Fraternity, Inc.",Other,Warrensburg,MO,Y,1156
Sigma Theta Tau International Honor Society of Nursing Inc,Other,Indianapolis,IN,Y,1157
"Sigma Theta Tau International Honor Society of Nursing, Inc.",Other,Indianapolis,IN,Y,1158
Sigma Xi The Scientific Research Society,Other,RTP,NC,Y,1159
"Sigma Xi, The Scientific Research Society",Other,Research Triangle Park,NC,Y,1160
Simmons College,University,Boston,MA,Y,1161
SIUE Alumni Association,Alumni Association,Edwardsville,IL,Y,1162
Slippery Rock State University,Foundation,Slippery Rock,PA,Y,1163
"Slippery Rock State University Foundation, Inc.",Foundation,Slippery Rock,PA,Y,1164
"Slippery Rock University Foundation, Inc.",Foundation,Slippery Rock,PA,Y,1165
Society for Mining Metallurgy and Exploration Inc,Other,Littleton,CO,Y,1166
"Society for Mining, Metallurgy and Exploration, Inc.",Other,Littleton,CO,Y,1167
Society of Nuclear Medicine,Other,New York,NY,Y,1168
Society of Plastics Engineers,Other,Brookfield,CT,Y,1169
Society of Women Engineers,Other,New York,NY,Y,1170
Soil and Water Conservation Society,Other,Ankeny,IA,Y,1171
Sonoma State University Alumni Association,Alumni Association,Rohnert,CA,Y,1172
"Sonoma State University Alumni Association, Inc.",Alumni Association,Rohnert Park,CA,Y,1173
Sonoma State University Alumni AssociationInc_SSU Development Office,Alumni Association,Rohnert Park,CA,Y,1174
South Dakota School of Mines & Technology Foundation,Foundation,Rapid City,SD,Y,1175
South Dakota School of Mines and Technology Foundation,Foundation,Rapid City,SD,Y,1176
South Dakota State University,Alumni Association,Brookings,SD,Y,1177
South Dakota State University Alumni Association ,Alumni Association,Brookings,SD,Y,1179
Southeast Missouri State University,University,Cape Girardeau,MO,Y,1180
Southeast Missouri University Foundation,Foundation,Cape Girardeau,MO,Y,1181
Southeastern College,University,Lakeland,FL,Y,1182
Southeastern Louisiana Alumni Association,Alumni Association,Hammond,LA,Y,1183
Southern Adventist University,University,Collegedale,TN,Y,1184
Southern Connecticut State University Alumni Association,Alumni Association,New Haven,CT,Y,1185
Southern Illinois University,Alumni Association,Carbondale,IL,Y,1186
Southern Illinois University Alumni Association,Alumni Association,Carbondale,IL,Y,1187
Southern Methodist University,University,Dallas,TX,Y,1188
