institution_name,inst_type_name,institution_city,state_abbv,active_ind,display_order
"College of Staten Island Alumni Association, Inc.",Alumni Association,Staten Island,NY,Y,377
College of the Holy Cross General Alumni Association,Alumni Association,Worcester,MA,Y,378
College of West Africa Alumni Association,Alumni Association,Bowie,MD,Y,379
College of West Africa Alumni AssociationUSA,Alumni Association,Bowie,MD,Y,381
"Colleges of the Seneca, Inc.",University,Geneva,NY,Y,382
Colorado Christian University,University,Lakewood,CO,Y,383
Colorado College,University,Colorado Springs,CO,Y,384
Colorado School of Mines,Other,Golden,CO,Y,385
Colorado School of Mines Alumni Association,Alumni Association,Golden,CO,Y,386
Colorado State,Alumni Association,Fort Collins,CO,Y,387
Colorado State Alumni Association,Alumni Association,Ft. Collins,CO,Y,388
Colorado State University Alumni Association,Alumni Association,Fort Collins,CO,Y,389
Columbus State University Alumni Association,Alumni Association,Columbus,GA,Y,390
Community College of Philadelphia,University,Philadelphia,PA,Y,391
Conservatorio de Música de PR,University,San Juan,PR,Y,392
Conservatorio de Música de Puerto Rico,University,San Juan,PR,Y,393
Converse College,University,Spartanburg,SC,Y,394
Cooper Union for the Advancement of Science and Art,University,New York,NY,Y,395
Cooper Union for the Advancement of Science and Art,University,New York City,NY,Y,396
Coppin State College Development Foundation Inc,Foundation,Baltimore,MD,Y,397
"Coppin State College Development Foundation, Inc.",Foundation,Baltimore,MD,Y,398
"Coppin State University Development Foundation, Inc.",Foundation,Baltimore,MD,Y,399
Cornell Alumni Federation,Alumni Association,Ithaca,NY,Y,400
Creighton University Alumni Association and Creighton University,"Alumni Association, University",Omaha,NE,Y,401
Crimson Tide Sports Marketing LLC,Other,Tuscaloosa,AL,Y,402
"Crimson Tide Sports Marketing, LLC",University,Tuscaloosa,AL,Y,404
Culver-Stockton College,University,Canton,MO,Y,407
Dakota State University Alumni Association,Alumni Association,Madison,SD,Y,408
Davenport University,University,Grand Rapids,MI,Y,409
Del Mar College Foundation/Alumni Association,Alumni Association,Corpus Christi,TX,Y,410
Delaware State University Alumni Association,Alumni Association,Dover,DE,Y,411
Delaware Technical & Community College Educational,University,Dover,DE,Y,412
Delaware Valley College,University,Doylestown,PA,Y,413
Delta Chi Fraternity Inc,Other,Iowa City,IA,Y,414
"Delta Chi Fraternity, Inc.",Other,Iowa City,IA,Y,415
Delta Delta Delta,Other,Arlington,TX,Y,416
Delta Delta Delta Fraternity,Other,Arlington,TX,Y,417
Delta Gamma Fraternity,Other,Columbus,OH,Y,418
Delta Iota House Corp.,Other,Denver,CO,Y,419
Delta Kappa Epsilon Fraternity,Other,Washington,DC,Y,420
Delta Kappa Gamma Society International,Other,Austin,TX,Y,421
"Delta Kappa Gamma Society, International",Other,Austin,TX,Y,422
Delta Mu Delta Honor Society,Other,Brookfield,IL,Y,423
Delta Phi Epsilon Sorority,Other,Maryland Heights,MO,Y,424
Delta Sigma Delta,Other,Dousman,WI,Y,425
Delta Sigma Delta,Other,Nekoosa,WI,Y,426
Delta Sigma Phi Fraternity,Other,Indianapolis,IN,Y,427
Delta Sigma Pi,Other,Oxford,OH,Y,428
Delta State University ,University,Cleveland,MS,Y,429
Delta State University Alumni Association,Alumni Association,Cleveland,MS,Y,430
Delta State University Alumni Association Inc,University,Cleveland,MS,Y,431
Delta Tau Delta Fraternity,Other,Fishers,IN,Y,432
Delta Theta Phi Law Fraternity,Other,Rocky River,OH,Y,433
Delta Upsilon International Fraternity,Other,Indianapolis,IN,Y,434
Delta Zeta Sorority,Other,Oxford,OH,Y,435
DePaul University,University, Chicago,IL,Y,436
DePaul University,University,Chicago,IL,Y,437
Des Moines University Osteopathic Medical Center,University,Des Moines,IA,Y,438
"Development Foundation of Western Carolina University, Inc.",Foundation,Cullowhee,NC,Y,439
Dickinson College,University,Carlisle,PA,Y,440
Dominican College,University,Orangeburg,NY,Y,441
Dominican College of San Rafael,University,San Rafael,CA,Y,442
Dominican University,University,River Forest,IL,Y,443
Dominican University of California,University,San Rafael,CA,Y,444
Dowling College,University,Oakdale,NY,Y,445
Drake University,University,Des Moines,IA,Y,446
Drexel University,University,Philadelphia,PA,Y,447
"Duke Alumni Association, Inc",Alumni Association,Durham,NC,Y,448
"Duke Alumni Association, Inc.",Alumni Association,Durham,NC,Y,449
Duke University Alumni Association,Alumni Association,Durham,NC,Y,450
Duquesne University,Alumni Association,Pittsburgh,PA,Y,451
Duquesne University Alumni Association,Alumni Association,Pittsburgh,PA,Y,452
Duquesne University Alumni Association ,Alumni Association,Pittsburgh,PA,Y,453
D'Youville College,University,Buffalo,NY,Y,454
East Carolina University Alumni Association Inc,Alumni Association,Greenville,NC,Y,455
"East Carolina University Alumni Association, Inc.",Alumni Association,Greenville,NC,Y,456
East Carolina University Alumni AssociationInc,Alumni Association,Greenville,NC,Y,457
East Central University Alumni Association,Alumni Association,Ada,OK,Y,458
East Stroudsburg University Foundation,Foundation,East Stroudsburg,PA,Y,459
East Stroudsburg University Foundation Inc,Foundation,East Stroudsburg,PA,Y,460
"East Stroudsburg University Foundation, Inc.",Foundation,East Stroudsburg,PA,Y,461
East Stroudsburg University of Pennsylvania,University,East Stroudsburg,PA,Y,462
East Tennessee State University Foundation,Foundation,Johnson City,TN,Y,463
Eastern Connecticut State University Alumni Association,Alumni Association,Willimantic,CT,Y,464
"Eastern Illinois University Alumni Association, Inc.",Alumni Association,Charleston,IL,Y,465
Eastern Illinois University Alumni AssociationInc,Alumni Association,Charleston,IL,Y,466
Eastern New Mexico University,University,Portales,NM,Y,467
Eastern New Mexico University Alumni Association,Alumni Association,Portales,NM,Y,468
"Eastern New Mexico University Alumni Association, Inc.",Alumni Association,Portales,NM,Y,469
Eastern New Mexico University Alumni AssociationInc,Alumni Association,Portales,NM,Y,470
Eastern Oregon University,University,LaGrande,OR,Y,471
Eastern Oregon University,University,La Grande,OR,Y,472
Eastern Washington University Alumni Association,Alumni Association,Cheney,WA,Y,473
Eckerd College Alumni Association,Alumni Association,St. Petersburg,FL,Y,474
ECSU Foundation,Foundation,Elizabeth City,NC,Y,475
Edinboro University of Pennsylvania,University,Edinboro,PA,Y,476
Edinboro University of Pennsylvania Alumni Association,Alumni Association,Edinboro,PA,Y,477
"Educational Communications, Inc.",Other,Lake Forest,IL,Y,478
Elizabethtown College,University,Elizabethtown,PA,Y,479
Elmhurst College,Alumni Association,Elmhurst,IL,Y,480
Elmhurst College Alumni Association,Alumni Association,Elmhurst,IL,Y,481
Elon College,University,Elon College,NC,Y,482
Elon University,University,Elon,NC,Y,483
Embry Riddle Aeronautical University,University,Daytona Beach,FL,Y,484
Emerson College,University,Boston,MA,Y,485
Emmanuel College,University,Boston,MA,Y,486
Emory University,University,Atlanta,GA,Y,487
Emporia State University Alumni Association,Alumni Association,Emporia,KS,Y,488
Erskine College,University,Due West,SC,Y,489
Erskine College Alumni Association,Alumni Association,Due West,SC,Y,490
Ex-Students Association of the University of Texas,Alumni Association,Austin,TX,Y,491
Fairfield University,University,Fairfield,CT,Y,492
Fairleigh Dickinson University,University,Teaneck,NJ,Y,493
"Fairmont State College Alumni Association, Inc.",Alumni Association,Fairmont,WV,Y,494
"Falcon Sports Properties, LLC",Other,Bowling Green,OH,Y,495
Faulkner University,University,Montgomery,AL,Y,496
Fayetteville State University ,University,Fayetteville,NC,Y,497
Felician College,University,Lodi,NJ,Y,498
Ferris State University,University,Big Rapids,MI,Y,499
FFA Alumni Association,Alumni Association,Alexandria,VA,Y,500
Fitchburg State College,University,Fitchburg,MA,Y,501
Fitzwilliam College,University,Cambridge,UK,Y,502
Florida Atlantic University Foundation Inc,Foundation,Boca Raton,FL,Y,503
"Florida Atlantic University Foundation, Inc.",Foundation,Boca Raton,FL,Y,504
Florida Brass Drum & Bugle,Other,Pompano Beach,FL,Y,505
Florida Institute of Technology,Alumni Association,Melbourne,FL,Y,506
Florida Institute of Technology Alumni Association,Alumni Association,Melbourne,FL,Y,507
Florida International University Alumni Association,Foundation,Miami,FL,Y,508
Florida International University Foundation Inc,Foundation,Miami,FL,Y,509
"Florida International University Foundation, Inc.",Foundation,Miami,FL,Y,510
Florida Pharmacy Association,Other,Tallahassee,FL,Y,511
Florida Southern College,University,Lakeland,FL,Y,512
Foothill De Anza College,University,Los Altos Hills,CA,Y,513
Fordham University,University,Bronx,NY,Y,514
Fort Hays State University Alumni Association,Alumni Association,Hays,KS,Y,515
Fort Lewis College Alumni Association,Alumni Association,Durango,CO,Y,516
Foundation at New Jersey Institute of Technology,Foundation,Newark,NJ,Y,517
Foundation Chapter of Theta Chi Fraternity Inc,Foundation,Indianapolis,IN,Y,518
"Foundation Chapter of Theta Chi Fraternity, Inc.",Foundation,Indianapolis,IN,Y,519
"Foundation of the University of North Carolina at Charlotte, Inc.",Foundation,Charlotte,NC,Y,520
Framingham State College,University,Framingham,MA,Y,521
Franklin and Marshall College,University,Lancaster,PA,Y,522
Franklin and Marshall College_Franklin and Marshall Alumni Association,University,Lancaster,PA,Y,523
Franklin and Marshall College_Franklin Marshall Alumni Association,University,Lancaster,PA,Y,524
Franklin Marshall Alumni Association,Alumni Association,Lancaster,PA,Y,525
Franklin Pierce College,University,Rindge,NH,Y,526
Fraternity of Alpha Zeta,Other,St. Louis,MO,Y,527
"Fraternity of Phi Gamma Delta, Inc.",Other,Lexington,KY,Y,528
Freed Hardeman University,University,Henderson,TN,Y,529
Furman University,University,Greenville,SC,Y,530
Gamma Phi Beta International Sorority Inc,Other,Englewood,CO,Y,531
"Gamma Phi Beta International Sorority, Inc.",Other,Englewood,CO,Y,532
Gemological Institute of America Alumni Association,Alumni Association,Santa Monica,CA,Y,533
General Alumni Assoc of Univ of N Carolina at Chapel Hill,Alumni Association,Chapel Hill,NC,Y,534
General Alumni Associationof the University of North Carolina at Chapel Hill,Alumni Association,Chapel Hill,NC,Y,535
Geneseo Alumni Association,Alumni Association,Geneseo,NY,Y,536
Geneva College,University,Beaver Falls,PA,Y,537
George Mason University,Alumni Association,Fairfax,VA,Y,538
George Mason University Alumni,Alumni Association,Fairfax,VA,Y,539
George Mason University Alumni Association,Alumni Association,Fairfax,VA,Y,540
George Washington Alumni Association,Alumni Association,Washington,DC,Y,541
Georgetown University Alumni Association,Alumni Association,Washington,DC,Y,542
Georgetown University Alumni Association Inc,Alumni Association,Washington,DC,Y,543
Georgia Pharmacy Foundation,Foundation,Atlanta,GA,Y,544
Georgia Southern University Foundation Inc,Foundation,Statesboro,GA,Y,545
"Georgia Southern University Foundation, Inc.",Foundation,Statesboro,GA,Y,546
Georgia Southwestern Foundation Inc,Foundation,Americus,GA,Y,547
"Georgia Southwestern Foundation, Inc.",Foundation,Americus,GA,Y,548
Georgia State University Alumni Association,Alumni Association,Atlanta,GA,Y,549
"Georgia State University Alumni Association, Inc.",Alumni Association,Atlanta,GA,Y,550
Georgia State University Alumni AssociationInc,Alumni Association,Atlanta,GA,Y,551
Georgia Tech Alumni Association,Alumni Association,Atlanta,GA,Y,552
Georgia Tech University,Alumni Association,Atlanta,GA,Y,553
Gettysburg College,University,Gettysburg,PA,Y,554
GIA Alumni Association,Alumni Association,Santa Monica,CA,Y,555
Golden Gate University,University,San Francisco,CA,Y,556
Golden Key International Honour Society,Other,Atlanta,GA,Y,557
Goldey Beacom College,University,Wilmington,DE,Y,558
Goshen College,University,Goshen,IN,Y,560
Graceland University,University,Lamoni,IA,Y,561
Grambling University National Alumni Association,Alumni Association,Grambling,LA,Y,562
Grand Chapter of Phi Sigma Kappa,Other,Indianapolis,IN,Y,563
Grand Valley State University,University,Allendale,MI,Y,564
Grand View College Alumni Association,University,Des Moines,IA,Y,565
Grand View University,University,Des Moines,IA,Y,566
Greater University of South Carolina Alumni Association,Alumni Association,Columbia,SC,Y,567
Green Mountain College,University,Poultney,VT,Y,568
Guilford College,University,Greensboro,NC,Y,569
Gustavus Adolphus College,University,Saint Peter,MN,Y,570
Gwynedd Mercy College,University,Gwynedd Valley,PA,Y,571
Hamline University,University,Saint Paul,MN,Y,572
Hampden Sydney College,University,Hampden Sydney,VA,Y,574
Hampton University,University,Hampton,VA,Y,575
Harding University Inc,University,Searcy,AR,Y,576
"Harding University, Inc.",University,Searcy,AR,Y,577
Harrisburg Area Community College,University,Harrisburg,PA,Y,578
Harrisburg Area Community College - Harrisburg Campus,University,Harrisburg,PA,Y,579
Harrisburg Area Community College - Lancaster Campus,University,Lancaster,PA,Y,580
Harrisburg Area Community College - York Campus,University,York,PA,Y,581
Hartwick College,University,Oneonta,NY,Y,582
Harvard Alumni Association ,Alumni Association,Cambridge,MA,Y,584
Haverford College,University,Haverford,PA,Y,585
Hawaii Pacific University,University,Honolulu,HI,Y,586
Henderson State University,University,Arkadelphia,AR,Y,587
Herbert H Lehman College Foundation Inc,Foundation,Bronx,NY,Y,588
"Herbert H. Lehman College Foundation, Inc.",Foundation,Bronx,NY,Y,589
"Heritage Affinity Enterprises, LLC",Other,Hewlett,NY,Y,590
Honor Society of Phi Kappa Phi,Other,Baton Rouge,LA,Y,591
Hood College,University,Frederick,MD,Y,592
Houghton College,University,Houghton,NY,Y,593
Houston Alumni Organization,Alumni Association,Houston,TX,Y,594
Houston Baptist University,University,Houston,TX,Y,595
Howard Payne University Alumni Association,Alumni Association,Brownwood,TX,Y,596
Howard University ,Alumni Association,Washington,DC,Y,597
Howard University Department of Alumni Relations,Alumni Association,Washington,DC,Y,598
Humboldt State University Alumni Association,Alumni Association,Arcata,CA,Y,599
Husson College Alumni Association,Alumni Association,Bangor,ME,Y,600
Husson University,Alumni Association,Bangor,ME,Y,601
Idaho State University,University,Pocatello,ID,Y,602
Illinois College of Optometry,University,Chicago,IL,Y,603
Illinois State University Foundation,Foundation,Normal,IL,Y,604
Immaculata College,University,Immaculata,PA,Y,605
Immaculata University,University,Immaculata,PA,Y,606
Independent University Alumni Associationat Lowell,Alumni Association,Lowell,MA,Y,607
Indiana State University,University,Terre Haute,IN,Y,608
Indiana State University Foundation Inc,Foundation,Terre Haute,IN,Y,609
Indiana University Alumni Association,Alumni Association,Bloomington,IN,Y,610
Indiana University Alumni Association Inc,Alumni Association,Bloomington,IN,Y,611
Indiana University of Pennsylvania Alumni Association,University,Indiana,PA,Y,613
"Indiana University of Pennsylvania Alumni Association, Inc.",Alumni Association,Indiana ,PA,Y,614
Indiana Wesleyan University,University,Marion,IN,Y,615
Institute of Industrial Engineers,Other,Norcross,GA,Y,616
Institute of Management Accountants,Other,Montvale,NJ,Y,617
International Chiropractors Association,Other,Arlington,VA,Y,618
International Legal Fraternity of Phi Delta Phi,Other,Greenbelt,MD,Y,619
International Legal Fraternity of Phi Delta Phi,Other,Washington,DC,Y,620
International Management Company (IMG),Other,Tucson,AZ,Y,621
International Society for Optical Engineering,Other,Bellingham,WA,Y,622
Iona College,University,New Rochelle,NY,Y,623
Iowa State University Alumni Association,Alumni Association,Ames,IA,Y,624
Ithaca College Alumni Association,Alumni Association,Ithaca,NY,Y,625
Ivy Tech Community College Northeast,University,Fort Wayne,IN,Y,626
Jackson State University,University,Jackson,MS,Y,627
Jacksonville State,Alumni Association,Jacksonville,AL,Y,628
Jacksonville State University Alumni Association ,Alumni Association,Jacksonville,AL,Y,630
"Jacksonville State University Foundation, Inc.",Foundation,Jacksonville,AL,Y,631
James Madison University Alumni Association,Alumni Association,Harrisonburg,VA,Y,632
Javelina Alumni Association,Alumni Association,Kingsville,TX,Y,633
"JMG JV, d/b/a Georgia Bulldogs Sports Marketing ",Other,Winston Salem,NC,Y,634
"JMIS Kentucky,LLC for University of Kentucky",Other,Lexington,KY,Y,635
JMUAA Alumni Association,Alumni Association,Harrisonburg,VA,Y,636
John Carroll University,University,University Heights,OH,Y,637
John F. Kennedy University Alumni Association,Alumni Association,Orinda,CA,Y,638
Johns Hopkins University,University,Baltimore,MD,Y,639
Johnson & Wales University,University,Providence,RI,Y,640
Johnson Wales University,University,Providence,RI,Y,641
Judson University,University,Elgin,IL,Y,642
Juilliard School,University,New York,NY,Y,643
Kansas State University Alumni Association,Alumni Association,Manhattan,KS,Y,645
Kansas University Alumni Association,Alumni Association,Lawrence ,KS,Y,646
Kappa Alpha Order,Other,Lexington,VA,Y,647
Kappa Alpha Psi,Other,Philadelphia,PA,Y,648
Kappa Alpha Theta Fraternity Inc,Other,Indianapolis,IN,Y,649
"Kappa Alpha Theta Fraternity, Inc.",Other,Indianapolis,IN,Y,650
Kappa Delta Pi An International Honor Society in Education,Other,Indianapolis,IN,Y,651
Kappa Delta Rho Fraternity,Other,Greensburg,PA,Y,652
"Kappa Delta Sorority, Inc.",Other,Memphis,TN,Y,653
Kappa Epsilon Fraternity,Other,Stone Mountain,GA,Y,654
Kappa Psi Pharmaceutical Fraternity,Other,Oklahoma City,OK,Y,655
Kappa Psi Pharmaceutical Fraternity,Other,Richardson,TX,Y,656
Kappa Sigma Fraternity,Other,Charlottesville,VA,Y,657
Kean University Alumni Association,Alumni Association,Union,NJ,Y,658
Keene State College Alumni Association,Alumni Association,Keene,NH,Y,659
Kennesaw State University Alumni Association,Alumni Association,Marietta,GA,Y,660
Kent State University,University,Kent,OH,Y,661
Kentucky Christian University,University,Grayson,KY,Y,662
Kentucky Wesleyan College,University,Owensboro,KY,Y,663
Keuka College,University,Keuka Park,NY,Y,664
Keystone College,Alumni Association,La Plume,PA,Y,665
Keystone College Alumni Association,Alumni Association,La Plume,PA,Y,666
Keystone College Keystone College Parents,Foundation,La Plume,PA,Y,667
Keystone College Parents,Foundation,La Plume,PA,Y,669
Kings College,University,Wilkes Barre,PA,Y,670
King's College,University,New York,NY,Y,671
Kutztown University Alumni Association,Alumni Association,Kutztown,PA,Y,672
Kutztown University Foundation Inc.,Foundation,Kutztown,PA,Y,673
Kutztown University of Pennsylvania,University,Kutztown,PA,Y,674
La Salle University Alumni Association,Alumni Association,Philadelphia,PA,Y,675
La Sierra University and La Sierra Alumni Association,"Alumni Association, University",Riverside,CA,Y,676
"La Sierra University, La Sierra Alumni Association",Alumni Association,Riverside,CA,Y,677
La Sierra University_La Sierra Alumni Association,Alumni Association,Riverside,CA,Y,678
Lafayette College Alumni Association,Alumni Association,Easton,PA,Y,679
Lake County Schools Alumni,Alumni Association,Memphis ,TN,Y,680
Lake Erie College,University,Painesville,OH,Y,681
Lake Sumter Community College Education Fund,University,Leesburg,FL,Y,682
"Lake Sumter Community College Foundation, Inc.",Foundation,Leesburg,FL,Y,683
Lake Superior State University,University,Sault Ste. Marie,MI,Y,684
"Lake-Sumter Community College Foundation, Inc.",Foundation,Leesburg,FL,Y,685
Lakewood Public School Alumni Foundation,Foundation,Lakewood,OH,Y,686
Lamar University,University,Beaumont,TX,Y,687
Lamar University Alumni Association,Alumni Association,Beaumont,TX,Y,688
Lambda Chi Alpha Fraternity Inc,Other,Indianapolis,IN,Y,689
"Lambda Chi Alpha Fraternity, Inc.",Other,Indianapolis,IN,Y,690
"Lambda Phi Epsilon National Fraternity, Inc.",Other,New Brunswick,NJ,Y,691
Lambda Sigma Upsilon Latino Fraternity,Other,Hoboken,NJ,Y,692
"Lambda Theta Nu Sorority, Inc.",Other,San Diego,CA,Y,693
Lambda Theta Phi,University,Parsippany,NJ,Y,695
Langston University National Alumni Association,Alumni Association,Langston,OK,Y,696
LaSalle University Alumni Association,Alumni Association,Philadelphia,PA,Y,697
Lawrence Technological University,University,Southfield,MI,Y,698
Lawrence University,University,Appleton,WI,Y,699
Le Moyne College,University,Syracuse,NY,Y,700
"Learfield Communications, Inc. on behalf of the University of Texas at Arlington",University,Arlington,TX,Y,701
Lebanon Valley College,University,Annville,PA,Y,702
Lee University,University,Cleveland,TN,Y,703
"Leland Stanford Junior University by Stanford Alumni Association and Stanford Department of Athletics, Physical Education and Recreation","Alumni Association, University",Stanford,CA,Y,704
Lenoir Rhyne College Alumni Association,Alumni Association,Hickory,NC,Y,705
Lesley College,University,Cambridge,MA,Y,706
Lesley University,University,Cambridge,MA,Y,707
Letourneau University,University,Longview,TX,Y,708
Lewis and Clark College,University,Portland,OR,Y,709
Lewis University,University,Romeoville,IL,Y,710
Liberty University,University,Lynchburg,VA,Y,711
Liberty University,Alumni Association,Lynchburg,VA,Y,712
Life College,University,Marietta,GA,Y,713
Life University,University,Marietta,GA,Y,714
Limestone College,University,Gaffney,SC,Y,715
Limestone College Bank NA,University,Gaffney,SC,Y,716
Lincoln Memorial University,University,Harrogate,TN,Y,717
Lindenwood University,"Alumni Association, University",Saint Charles,MO,Y,718
Lindenwood University,Alumni Association,St Charles,MO,Y,719
Lock Haven University Alumni Association,Alumni Association,Lock Haven ,PA,Y,721
Lock Haven University Foundation,Foundation,Lock Haven,PA,Y,722
Lock Haven University of Pennsylvania,University,Lock Haven,PA,Y,723
Long Island University,University,Brookville,NY,Y,724
Longwood University Alumni Association,Alumni Association,Farmville,VA,Y,725
Loras College,Alumni Association,Dubuque,IA,Y,726
Louisiana State University Medical Center Foundation,Foundation,New Orleans,LA,Y,727
Louisiana State University Shreveport Alumni Association,Alumni Association,Shreveport,LA,Y,728
Louisiana Tech University Foundation,Foundation,Ruston,LA,Y,729
Loyola Blakefield Alumni Association,Alumni Association,Baltimore,MD,Y,730
Loyola College in Maryland,University,Baltimore,MD,Y,731
Loyola Marymount University,University,Los Angeles,CA,Y,732
Loyola University Chicago,University,Chicago,IL,Y,733
Loyola University Maryland,University,Baltimore,MD,Y,734
Loyola University New Orleans,University,New Orleans,LA,Y,735
Loyola University of Chicago,University,Chicago,IL,Y,736
LSU Alumni Association,Alumni Association,Baton Rouge,LA,Y,737
Lubbock Christian University,University,Lubbock,TX,Y,738
Luther College,University,Decorah,IA,Y,739
"Lutheran University Association, Inc., d/b/a Valparaiso University",University,Valparaiso,IN,Y,740
Lycoming College,University,Williamsport,PA,Y,741
Manhattan College,University,Riverdale,NY,Y,742
Manhattanville College,University,Purchase,NY,Y,743
Mansfield University Foundation Inc,Foundation,Mansfield,PA,Y,744
"Mansfield University Foundation, Inc.",Foundation,Mansfield,PA,Y,745
Mansfield University of Pennsylvania,University,Mansfield,PA,Y,746
Marian College,University,Indianapolis,IN,Y,747
Marquette University,University,Milwaukee,WI,Y,748
Marshall University Alumni Association,Alumni Association,Huntington ,WV,Y,750
Martin Luther College Alumni Association,Alumni Association,New Ulm,MN,Y,751
Mary Baldwin College,University,Staunton,VA,Y,752
Marymount University,University,Arlington,VA,Y,753
Maryville College,University,Maryville,TN,Y,754
Massachusetts College of Pharmacy and Allied Health Sciences,University,Boston,MA,Y,755
Massachusetts Institue of Technology (MIT) Alumni Association,Alumni Association,Cambridge,MA,Y,756
Massachusetts Institute of Technology,University,Cambridge,MA,Y,757
Massachusetts Institute of Technology (MIT) Alumni Association,Alumni Association,Cambridge,MA,Y,759
Massachusetts Medical Society,Other,Waltham,MA,Y,760
McGeorge School of Law,University,Sacramento,CA,Y,761
Mcneese State Alumni Association,Alumni Association,Lake Charles,LA,Y,762
McNeese State University Alumni Association,Alumni Association,Lake Charles,LA,Y,763
Medical College of Virginia Alumni Associationof Virginia Commonwealth University,Alumni Association,Richmond,VA,Y,764
Meharry National Alumni Association,Alumni Association,Nashville,TN,Y,765
MENC:  The National Association for Music Education,Other,Reston,VA,Y,766
MENC: The National Association for Music Education,Other,Reston,VA,Y,767
Menlo College,University,Atherton,CA,Y,768
Mercy College Alumni Association,Alumni Association,Dobbs Ferry,NY,Y,769
Mercyhurst College,University,Erie,PA,Y,770
Meredith College,University,Raleigh,NC,Y,771
Merrimack College,University,North Andover,MA,Y,772
Methodist College Incorporated,University,Fayetteville,NC,Y,773
Metropolitan State University Foundation,Foundation,St. Paul,MN,Y,774
Michigan State University,University,East Lansing,MI,Y,775
Michigan Tech University,Alumni Association,Houghton,MI,Y,776
Michigan Technological University,University,Houghton,MI,Y,777
Michigan Technological University a Michigan Constitutional University,University,Houghton,MI,Y,778
"Michigan Technological University, Michigan Constitutional University","Alumni Association, University",Houghton,MI,Y,780
"Middle Tennessee State University National Alumni Association and Middle Tennessee State University Foundation, Inc.","Alumni Association, Foundation",Murfreesboro,TN,Y,781
